{
  "$schema": "https://json-schema.org/draft/2020-12/schema",
  "type": "object",
  "properties": {
    "schemaVersion": {
      "type": "number",
      "const": 1
    },
    "generatedAt": {
      "type": "string",
      "pattern": "^(\\d{4})-(\\d{2})-(\\d{2})T(\\d{2}):(\\d{2}):(\\d{2})Z$"
    },
    "generatedBy": {
      "type": "string"
    },
    "project": {
      "type": "object",
      "properties": {
        "id": {
          "type": "string",
          "pattern": "^[0-7][0-9A-HJKMNP-TV-Z]{25}$"
        },
        "name": {
          "type": "string",
          "minLength": 1
        },
        "created": {
          "type": "string",
          "pattern": "^(\\d{4})-(\\d{2})-(\\d{2})T(\\d{2}):(\\d{2}):(\\d{2})Z$"
        },
        "locale": {
          "type": "string"
        },
        "citationStyle": {
          "type": "string"
        },
        "formatVersion": {
          "type": "integer",
          "minimum": -9007199254740991,
          "maximum": 9007199254740991
        },
        "archived": {
          "anyOf": [
            {
              "type": "string",
              "pattern": "^(\\d{4})-(\\d{2})-(\\d{2})T(\\d{2}):(\\d{2}):(\\d{2})Z$"
            },
            {
              "type": "null"
            }
          ]
        }
      },
      "required": [
        "id",
        "name",
        "created",
        "locale",
        "citationStyle",
        "formatVersion",
        "archived"
      ]
    },
    "questions": {
      "type": "array",
      "items": {
        "type": "object",
        "properties": {
          "id": {
            "type": "string",
            "pattern": "^[0-7][0-9A-HJKMNP-TV-Z]{25}$"
          },
          "ref": {
            "type": "string"
          },
          "title": {
            "type": "string",
            "minLength": 1
          },
          "created": {
            "type": "string",
            "pattern": "^(\\d{4})-(\\d{2})-(\\d{2})T(\\d{2}):(\\d{2}):(\\d{2})Z$"
          },
          "motivation": {
            "type": "string"
          },
          "experiments": {
            "type": "array",
            "items": {
              "type": "string"
            }
          },
          "markdown": {
            "type": "string"
          }
        },
        "required": [
          "id",
          "ref",
          "title",
          "created",
          "motivation",
          "experiments",
          "markdown"
        ]
      }
    },
    "experiments": {
      "type": "array",
      "items": {
        "type": "object",
        "properties": {
          "id": {
            "type": "string",
            "pattern": "^[0-7][0-9A-HJKMNP-TV-Z]{25}$"
          },
          "ref": {
            "type": "string"
          },
          "folder": {
            "type": "string"
          },
          "question": {
            "type": "string",
            "pattern": "^[0-7][0-9A-HJKMNP-TV-Z]{25}$"
          },
          "title": {
            "type": "string",
            "minLength": 1
          },
          "status": {
            "type": "string",
            "enum": [
              "planned",
              "running",
              "complete",
              "abandoned"
            ]
          },
          "started": {
            "type": [
              "string",
              "null"
            ]
          },
          "completed": {
            "type": [
              "string",
              "null"
            ]
          },
          "created": {
            "type": "string",
            "pattern": "^(\\d{4})-(\\d{2})-(\\d{2})T(\\d{2}):(\\d{2}):(\\d{2})Z$"
          },
          "updated": {
            "type": "string",
            "pattern": "^(\\d{4})-(\\d{2})-(\\d{2})T(\\d{2}):(\\d{2}):(\\d{2})Z$"
          },
          "preamble": {
            "type": "string"
          },
          "sections": {
            "type": "array",
            "items": {
              "type": "object",
              "properties": {
                "key": {
                  "type": "string",
                  "enum": [
                    "methods",
                    "results_notes",
                    "interpretation",
                    "unknown"
                  ]
                },
                "heading": {
                  "type": "string"
                },
                "markdown": {
                  "type": "string"
                }
              },
              "required": [
                "key",
                "heading",
                "markdown"
              ]
            }
          },
          "literature": {
            "type": [
              "string",
              "null"
            ]
          },
          "citekeys": {
            "type": "array",
            "items": {
              "type": "string"
            }
          },
          "artefacts": {
            "type": "object",
            "properties": {
              "state": {
                "type": "string",
                "enum": [
                  "none",
                  "read",
                  "unreadable"
                ]
              },
              "items": {
                "type": "array",
                "items": {
                  "type": "object",
                  "properties": {
                    "id": {
                      "type": "string",
                      "pattern": "^[0-7][0-9A-HJKMNP-TV-Z]{25}$"
                    },
                    "name": {
                      "type": "string",
                      "minLength": 1
                    },
                    "role": {
                      "type": "string",
                      "enum": [
                        "result",
                        "method"
                      ]
                    },
                    "type": {
                      "type": "string",
                      "enum": [
                        "image",
                        "pdf",
                        "svg",
                        "table",
                        "script",
                        "notebook",
                        "text",
                        "html",
                        "other"
                      ]
                    },
                    "mode": {
                      "type": "string",
                      "enum": [
                        "copy",
                        "link"
                      ]
                    },
                    "sourceRoot": {
                      "type": "string"
                    },
                    "sourcePath": {
                      "type": "string"
                    },
                    "created": {
                      "type": "string",
                      "pattern": "^(\\d{4})-(\\d{2})-(\\d{2})T(\\d{2}):(\\d{2}):(\\d{2})Z$"
                    },
                    "versions": {
                      "type": "array",
                      "items": {
                        "type": "object",
                        "properties": {
                          "v": {
                            "type": "integer",
                            "minimum": 1,
                            "maximum": 9007199254740991
                          },
                          "file": {
                            "type": "string"
                          },
                          "sha256": {
                            "type": "string",
                            "pattern": "^[0-9a-f]{64}$"
                          },
                          "size": {
                            "type": "integer",
                            "minimum": 0,
                            "maximum": 9007199254740991
                          },
                          "captured": {
                            "type": "string",
                            "pattern": "^(\\d{4})-(\\d{2})-(\\d{2})T(\\d{2}):(\\d{2}):(\\d{2})Z$"
                          }
                        },
                        "required": [
                          "v",
                          "file",
                          "sha256",
                          "size",
                          "captured"
                        ]
                      }
                    },
                    "link": {
                      "anyOf": [
                        {
                          "type": "object",
                          "properties": {
                            "sha256": {
                              "type": "string",
                              "pattern": "^[0-9a-f]{64}$"
                            },
                            "size": {
                              "type": "integer",
                              "minimum": 0,
                              "maximum": 9007199254740991
                            },
                            "observedMtime": {
                              "type": "string",
                              "pattern": "^(\\d{4})-(\\d{2})-(\\d{2})T(\\d{2}):(\\d{2}):(\\d{2})Z$"
                            },
                            "checked": {
                              "type": "string",
                              "pattern": "^(\\d{4})-(\\d{2})-(\\d{2})T(\\d{2}):(\\d{2}):(\\d{2})Z$"
                            }
                          },
                          "required": [
                            "sha256",
                            "size",
                            "observedMtime",
                            "checked"
                          ]
                        },
                        {
                          "type": "null"
                        }
                      ]
                    }
                  },
                  "required": [
                    "id",
                    "name",
                    "role",
                    "type",
                    "mode",
                    "sourceRoot",
                    "sourcePath",
                    "created",
                    "versions",
                    "link"
                  ]
                }
              },
              "groups": {
                "type": "array",
                "items": {
                  "$ref": "#/$defs/__schema0"
                }
              }
            },
            "required": [
              "state",
              "items",
              "groups"
            ]
          },
          "markdown": {
            "type": "string"
          }
        },
        "required": [
          "id",
          "ref",
          "folder",
          "question",
          "title",
          "status",
          "started",
          "completed",
          "created",
          "updated",
          "preamble",
          "sections",
          "literature",
          "citekeys",
          "artefacts",
          "markdown"
        ]
      }
    },
    "notExported": {
      "type": "array",
      "items": {
        "type": "string"
      }
    }
  },
  "required": [
    "schemaVersion",
    "generatedAt",
    "generatedBy",
    "project",
    "questions",
    "experiments",
    "notExported"
  ],
  "$defs": {
    "__schema0": {
      "type": "object",
      "properties": {
        "id": {
          "type": "string",
          "pattern": "^[0-7][0-9A-HJKMNP-TV-Z]{25}$"
        },
        "name": {
          "type": "string",
          "minLength": 1
        },
        "items": {
          "type": "array",
          "items": {
            "type": "string",
            "pattern": "^[0-7][0-9A-HJKMNP-TV-Z]{25}$"
          }
        },
        "groups": {
          "type": "array",
          "items": {
            "$ref": "#/$defs/__schema0"
          }
        }
      },
      "required": [
        "id",
        "name",
        "items",
        "groups"
      ]
    }
  },
  "title": "notebook.json (export schema version 1)"
}
