{
  "schemaVersion": 1,
  "generatedAt": "2026-10-09T12:00:00Z",
  "generatedBy": "0.2.0",
  "project": {
    "id": "01JAX9Q2B7N4M8T6V3W5Y1Z0KC",
    "name": "Batch effects in treated organoids",
    "created": "2026-09-01T09:12:44Z",
    "locale": "en-GB",
    "citationStyle": "nature.csl",
    "formatVersion": 2,
    "archived": null
  },
  "questions": [
    {
      "id": "01JAXA1C5D8E2F4G6H7J9K0M1N",
      "ref": "Q-001",
      "title": "Why does it grow?",
      "created": "2026-09-01T10:00:00Z",
      "motivation": "Because **yeast**.",
      "experiments": [
        "EXP-001"
      ],
      "markdown": "markdown/Q-001.md"
    }
  ],
  "experiments": [
    {
      "id": "01JAXQ8M3K7T2V9R4W6Y5Z0B1C",
      "ref": "EXP-001",
      "folder": "EXP-001",
      "question": "01JAXA1C5D8E2F4G6H7J9K0M1N",
      "title": "PCA run",
      "status": "planned",
      "started": null,
      "completed": null,
      "created": "2026-09-21T10:00:00Z",
      "updated": "2026-09-21T10:00:00Z",
      "preamble": "",
      "sections": [
        {
          "key": "methods",
          "heading": "Methods",
          "markdown": "Samples were **grown** overnight, see [PCA](evidence/pca.pdf \"art:01JAXR5D8K2M4N6P8Q0R2S4T6V v2\") and [volcano](evidence/volcano.png \"art:01JAXR1A1A1A1A1A1A1A1A1A1A\") [@z:u:7XK2PQ9M, p. 4]."
        },
        {
          "key": "results_notes",
          "heading": "Results notes",
          "markdown": ""
        },
        {
          "key": "interpretation",
          "heading": "Interpretation",
          "markdown": ""
        }
      ],
      "literature": null,
      "citekeys": [
        "z:u:7XK2PQ9M"
      ],
      "artefacts": {
        "state": "read",
        "items": [
          {
            "id": "01JAXR2B4C6D8E0F2G4H6J8K0M",
            "name": "PCA script",
            "role": "method",
            "type": "script",
            "mode": "copy",
            "sourceRoot": "project",
            "sourcePath": "scripts/02_pca.R",
            "created": "2026-09-03T13:58:02Z",
            "versions": [
              {
                "v": 1,
                "file": "methods/02_pca.R",
                "sha256": "5c0e5c0e5c0e5c0e5c0e5c0e5c0e5c0e5c0e5c0e5c0e5c0e5c0e5c0e5c0e5c0e",
                "size": 4121,
                "captured": "2026-09-03T13:58:02Z"
              }
            ],
            "link": null
          },
          {
            "id": "01JAXR5D8K2M4N6P8Q0R2S4T6V",
            "name": "PCA by treatment",
            "role": "result",
            "type": "pdf",
            "mode": "copy",
            "sourceRoot": "project",
            "sourcePath": "results/pca/pca_by_treatment.pdf",
            "created": "2026-09-03T14:02:11Z",
            "versions": [
              {
                "v": 1,
                "file": "evidence/pca_by_treatment.pdf",
                "sha256": "9b1c9b1c9b1c9b1c9b1c9b1c9b1c9b1c9b1c9b1c9b1c9b1c9b1c9b1c9b1c9b1c",
                "size": 88213,
                "captured": "2026-09-03T14:02:11Z"
              },
              {
                "v": 2,
                "file": "evidence/pca_by_treatment.v2.pdf",
                "sha256": "4e7a4e7a4e7a4e7a4e7a4e7a4e7a4e7a4e7a4e7a4e7a4e7a4e7a4e7a4e7a4e7a",
                "size": 90411,
                "captured": "2026-09-05T09:40:52Z"
              }
            ],
            "link": null
          },
          {
            "id": "01JAXR6E1F3G5H7J9K1M3N5P7Q",
            "name": "PCA by batch",
            "role": "result",
            "type": "pdf",
            "mode": "copy",
            "sourceRoot": "project",
            "sourcePath": "results/pca/pca_by_batch.pdf",
            "created": "2026-09-03T14:05:30Z",
            "versions": [
              {
                "v": 1,
                "file": "evidence/pca_by_batch.pdf",
                "sha256": "a3d5a3d5a3d5a3d5a3d5a3d5a3d5a3d5a3d5a3d5a3d5a3d5a3d5a3d5a3d5a3d5",
                "size": 79002,
                "captured": "2026-09-03T14:05:30Z"
              }
            ],
            "link": null
          },
          {
            "id": "01JAXR9Q1W3E5R7T9Y1V3J5N7P",
            "name": "Raw counts",
            "role": "result",
            "type": "other",
            "mode": "link",
            "sourceRoot": "project",
            "sourcePath": "data/counts.h5",
            "created": "2026-09-02T10:00:00Z",
            "versions": [],
            "link": {
              "sha256": "c21fc21fc21fc21fc21fc21fc21fc21fc21fc21fc21fc21fc21fc21fc21fc21f",
              "size": 18400000000,
              "observedMtime": "2026-08-30T22:14:09Z",
              "checked": "2026-09-05T16:00:00Z"
            }
          },
          {
            "id": "01JAXR1A1A1A1A1A1A1A1A1A1A",
            "name": "Volcano plot",
            "role": "result",
            "type": "image",
            "mode": "copy",
            "sourceRoot": "project",
            "sourcePath": "results/volcano.png",
            "created": "2026-09-03T14:02:11Z",
            "versions": [
              {
                "v": 1,
                "file": "evidence/volcano.png",
                "sha256": "a10a10a10a10a10a10a10a10a10a10a10a10a10a10a10a10a10a10a10a10a10a",
                "size": 100,
                "captured": "2026-09-03T14:02:11Z"
              },
              {
                "v": 2,
                "file": "evidence/volcano.v2.png",
                "sha256": "a11a11a11a11a11a11a11a11a11a11a11a11a11a11a11a11a11a11a11a11a11a",
                "size": 100,
                "captured": "2026-09-03T14:02:11Z"
              }
            ],
            "link": null
          },
          {
            "id": "01JAXR2B2B2B2B2B2B2B2B2B2B",
            "name": "Counts",
            "role": "result",
            "type": "table",
            "mode": "copy",
            "sourceRoot": "project",
            "sourcePath": "results/counts.csv",
            "created": "2026-09-03T14:02:11Z",
            "versions": [
              {
                "v": 1,
                "file": "evidence/counts.csv",
                "sha256": "b20b20b20b20b20b20b20b20b20b20b20b20b20b20b20b20b20b20b20b20b20b",
                "size": 100,
                "captured": "2026-09-03T14:02:11Z"
              }
            ],
            "link": null
          },
          {
            "id": "01JAXR3C3C3C3C3C3C3C3C3C3C",
            "name": "Diagram",
            "role": "result",
            "type": "svg",
            "mode": "copy",
            "sourceRoot": "project",
            "sourcePath": "results/diagram.svg",
            "created": "2026-09-03T14:02:11Z",
            "versions": [
              {
                "v": 1,
                "file": "evidence/diagram.svg",
                "sha256": "c30c30c30c30c30c30c30c30c30c30c30c30c30c30c30c30c30c30c30c30c30c",
                "size": 100,
                "captured": "2026-09-03T14:02:11Z"
              }
            ],
            "link": null
          }
        ],
        "groups": [
          {
            "id": "01JAXS0A2B4C6D8E0F2G4H6J8K",
            "name": "Figures",
            "items": [
              "01JAXR5D8K2M4N6P8Q0R2S4T6V",
              "01JAXR6E1F3G5H7J9K1M3N5P7Q"
            ],
            "groups": [
              {
                "id": "01JAXS1B3C5D7E9F1G3H5J7K9M",
                "name": "QC",
                "items": [
                  "01JAXR6E1F3G5H7J9K1M3N5P7Q"
                ],
                "groups": []
              }
            ]
          }
        ]
      },
      "markdown": "markdown/EXP-001.md"
    }
  ],
  "notExported": []
}
